# SLT cases — subqueries: scalar, correlated, IN/EXISTS/NOT IN,
# derived tables, and CTEs (WITH, including recursive).

statement ok
CREATE TABLE t (id INTEGER PRIMARY KEY, g TEXT, v INTEGER)

statement ok
INSERT INTO t (g, v) VALUES ('a', 1), ('a', 2), ('b', 3), ('b', 4), ('c', 5), ('c', 6)

# Scalar subquery in SELECT list.
query II
SELECT id, (SELECT MAX(v) FROM t) FROM t WHERE id = 1
----
1 6

# Scalar subquery in WHERE.
query II rowsort
SELECT id, v FROM t WHERE v > (SELECT AVG(v) FROM t)
----
4 4
5 5
6 6

# Uncorrelated IN subquery.
query II rowsort
SELECT id, v FROM t WHERE v IN (SELECT v FROM t WHERE g = 'a')
----
1 1
2 2

# Correlated IN: rows in a group that has any member above 4.
query I rowsort
SELECT id FROM t WHERE id IN (SELECT t2.id FROM t t2 WHERE t2.g = t.g AND t2.v > 4)
----
5
6

# EXISTS with correlation.
query TI rowsort
SELECT g, COUNT(*) FROM t GROUP BY g HAVING EXISTS (SELECT 1 FROM t t2 WHERE t2.g = t.g AND t2.v > 4)
----
c 2

# NOT IN with NULL in the subquery result: empty (three-valued logic).
statement ok
CREATE TABLE hasnull (x INTEGER)

statement ok
INSERT INTO hasnull VALUES (1), (NULL), (3)

query I
SELECT COUNT(*) FROM t WHERE v NOT IN (SELECT x FROM hasnull)
----
0

# NOT IN without NULLs.
query I
SELECT COUNT(*) FROM t WHERE v NOT IN (SELECT x + 1 FROM hasnull WHERE x IS NOT NULL)
----
4

# Derived table (subquery in FROM).
query TI rowsort
SELECT g, total FROM (SELECT g, SUM(v) AS total FROM t GROUP BY g)
----
a 3
b 7
c 11

# Correlated scalar subquery (per-group max).
query III rowsort
SELECT id, g, v FROM t WHERE v = (SELECT MAX(v) FROM t t2 WHERE t2.g = t.g)
----
2 a 2
4 b 4
6 c 6

# CTE: non-recursive.
query I rowsort
WITH big AS (SELECT * FROM t WHERE v > 3) SELECT COUNT(*) FROM big
----
3

# CTE referenced twice.
query II rowsort
WITH m AS (SELECT MAX(v) AS mv FROM t) SELECT mv, mv * 2 FROM m
----
6 12

# Recursive CTE: 1..10.
query I nosort
WITH RECURSIVE cnt(x) AS (VALUES (1) UNION ALL SELECT x + 1 FROM cnt WHERE x < 10) SELECT x FROM cnt
----
1
2
3
4
5
6
7
8
9
10

# Subquery in UPDATE.
statement ok
UPDATE t SET v = v + 100 WHERE g IN (SELECT g FROM t WHERE v >= 5)

query I
SELECT COUNT(*) FROM t WHERE v > 100
----
2

# Subquery in DELETE.
statement ok
DELETE FROM t WHERE v < (SELECT MIN(v) + 100 FROM t)

query I
SELECT COUNT(*) FROM t
----
2
